[
  {
    "response_version": 3,
    "worksheet_sha256": "084ca4362081ec105b3f192157cebe8cf28fc479c538ebe0c8a7988752c47eb4",
    "task_id": "d34f1ad33808ea4ec4b52c1e92bb0eb6c3eb28582ff615d4abd7236b0321e1d0",
    "task_sha256": "3c290c772568ae88d6697cd455d6880498486e0f4db321de775ef245b42a93b0",
    "canonical_repository_id": "yt-dlp/yt-dlp",
    "event_id": "95fa29a0338b42241a604f90572e28e5e46221269a1eb254c76e6dc8c03015cf",
    "review_role": "primary",
    "reviewer_id": "ai-ban-auditor-b",
    "decision": "reject",
    "default_branch_supported": false,
    "policy_scope": "not_applicable",
    "evidence_tier": "not_applicable",
    "rationale": "The frozen contribution guideline recommends one code-access pattern over chained get calls; it does not concern AI-authored contributions.",
    "evidence_citations": [
      "https://github.com/yt-dlp/yt-dlp/blob/fdcc954df4955267ec1627cbeb347b661a110e7c/CONTRIBUTING.md#L376"
    ],
    "outcomes_consulted": false,
    "response_sha256": "a13b15833dc366b6f9b3f05761c2b12b51cdaaf5317e4453c008c40f3caad7ec"
  },
  {
    "response_version": 3,
    "worksheet_sha256": "084ca4362081ec105b3f192157cebe8cf28fc479c538ebe0c8a7988752c47eb4",
    "task_id": "74fa34b3dd53a4f6f46d0efd9c6a1a60f723f0bdd86a14923667f356b20709fb",
    "task_sha256": "f9279cf5e3b1a7224b019d97fddd73400799b59fbe691d18d0ee4184a69e4b32",
    "canonical_repository_id": "superseriousbusiness/gotosocial",
    "event_id": "53212fe3b22962dd38d4fd056f27c71d1175e290fd0303605cbda16793fb5547",
    "review_role": "primary",
    "reviewer_id": "ai-ban-auditor-b",
    "decision": "accept_policy",
    "default_branch_supported": true,
    "policy_scope": "repository_wide_ai_generated_contribution_prohibition",
    "evidence_tier": "datable_default_branch_policy",
    "rationale": "The dated default-branch code of conduct says the project will not accept code or other changes created with the aid of AI tooling, establishing a repository-wide prohibition.",
    "evidence_citations": [
      "https://codeberg.org/superseriousbusiness/gotosocial"
    ],
    "outcomes_consulted": false,
    "response_sha256": "ea81170191b14a8b90cd1ed3d153dd2603f86288a97a047e079072490fa4e1c6"
  }
]
