[
  {
    "response_version": 3,
    "worksheet_sha256": "cbf925b94daeb144d70626143b5922c0bc4a00ac131bcce2878357acb3642c9b",
    "task_id": "6aa8e8424648ee3272770c8bd9daf1860dd12cd275b53a86614754d6fff9192f",
    "task_sha256": "bf03fbd359d584af5477ce0c0b10033b35c896ce3130b4724ad2a2c7747dbdaa",
    "canonical_repository_id": "yt-dlp/yt-dlp",
    "event_id": "f1ae30bcd8657c2dd16e5c8a1db5fc299b2d4c3aa2a471c0abe288aca109a425",
    "review_role": "primary",
    "reviewer_id": "ai-ban-auditor-b",
    "decision": "reject",
    "default_branch_supported": false,
    "policy_scope": "not_applicable",
    "evidence_tier": "not_applicable",
    "rationale": "The frozen README update narrows which player clients support an ad-playback option and repeats a premium-cookie warning; it contains no AI-contribution policy.",
    "evidence_citations": [
      "https://github.com/yt-dlp/yt-dlp/blob/fdcc954df4955267ec1627cbeb347b661a110e7c/README.md#L1883"
    ],
    "outcomes_consulted": false,
    "response_sha256": "975fee786e6232ab92a6a7fbed12a38613dd5084174cd52d56e4b6e96e3f272e"
  }
]
